Submission / Project,Round,Submission Title,Project,Category (from Project),Submission URL,Status,Tranche Completion %,Latest Tranche (from Payments),Total Awarded (USD),Total Paid (USD),Total Paid (XLM),Most Recent Payment Date,Award Type,One-Sentence-Description,Products & Services,Technical Architecture,Success Criteria,Website,Code,Video,Use Soroban?,Go-To-Market Plan,Traction Evidence,Tranche 1 - Deliverables,Tranche 2 - Testnet,Tranche 3 - Mainnet,Team Members,Thumbnail,LinkedIn (from Project),X (from Project),Discord (from Project),Pitch Deck (from Project)
Rigel,SCF #5,Rigel - Monetize Links for Payments and Donations in Seconds Stellar,Rigel,Applications,https://communityfund.stellar.org/dashboard/submissions/recHn7buQXsekeDpI,Awarded,,SCF Legacy Award,$14101.43,$14101.43,130434.78,8/18/2020,Legacy v1.0 Award,,"OpenSolar: Securitized Project Financing Powered by Stellar

OpenSolar is a decentralized platform that leverages the Stellar blockchain to provide securitized project financing for solar energy projects. By utilizing blockchain technology, OpenSolar aims to streamline the financing process, reduce costs, and increase transparency for all stakeholders involved.

The platform connects solar project developers with investors, enabling the creation of asset-backed tokens that represent ownership in solar projects. These tokens can be traded on the Stellar decentralized exchange, providing liquidity and flexibility for investors.

OpenSolar's key features include:

1. Decentralized Financing: By using the Stellar blockchain, OpenSolar eliminates the need for intermediaries, reducing costs and increasing efficiency.
2. Asset-Backed Tokens: Investors receive tokens that represent ownership in solar projects, providing a tangible asset that can be traded on the Stellar decentralized exchange.
3. Transparency: All transactions and project details are recorded on the blockchain, ensuring transparency and trust for all parties involved.
4. Liquidity: The ability to trade asset-backed tokens on the Stellar decentralized exchange provides liquidity and flexibility for investors.

OpenSolar aims to revolutionize the solar energy financing industry by providing a more efficient, transparent, and accessible platform for project developers and investors.",,,,,,,,,,,,,,,,,
Lettuce,SCF #5,Lettuce: Stellar-based point of sale (POS) Application ,Lettuce,Applications,https://communityfund.stellar.org/dashboard/submissions/recVosDQk5KM5Vj7Y,Awarded,,SCF Legacy Award,$48714.05,$48714.05,450592.89,8/18/2020,Legacy v1.0 Award,,"Cosmic.vote is a project that aims to create a decentralized voting platform for organizations. The goal is to provide a secure, transparent, and efficient way for members of an organization to vote on various issues. The platform will be built on blockchain technology, ensuring that all votes are immutable and verifiable. This will help to prevent fraud and ensure that the voting process is fair and transparent. The platform will also be designed to be user-friendly, making it easy for members of an organization to participate in the voting process. The project is currently in the development stage, with a team of experienced developers working to build the platform. The team is also working on creating a user interface that is intuitive and easy to use. Once the platform is complete, it will be tested extensively to ensure that it is secure and reliable. The team is also working on creating documentation and tutorials to help users understand how to use the platform. The goal is to make it as easy as possible for organizations to adopt the platform and start using it for their voting needs. The project is open source, and the team welcomes contributions from the community. If you are interested in contributing to the project, you can find more information on the project's GitHub page. The team is also looking for feedback from potential users to help improve the platform. If you have any suggestions or feedback, please feel free to reach out to the team.",,,,,,,,,,,,,,,,,
MXlet,SCF #5,MXlet - Open Stellar Hardware Wallet ,MXlet,Applications,https://communityfund.stellar.org/dashboard/submissions/rec5yVPK5GlSQgpOG,Awarded,,SCF Legacy Award,$19229.23,$19229.23,177865.61,8/18/2020,Legacy v1.0 Award,,"Lettuce is a Stellar-based Point of Sale (POS) application designed to facilitate cryptocurrency transactions in retail environments. The application aims to provide a seamless and efficient way for merchants to accept Stellar-based payments, enhancing the overall customer experience. Lettuce leverages the Stellar network's fast and low-cost transactions to offer a competitive alternative to traditional payment methods. The application is designed with user-friendliness in mind, ensuring that both merchants and customers can easily navigate and utilize its features. Lettuce supports multiple currencies and offers real-time conversion rates, making it versatile for international transactions. The application also includes robust security measures to protect against fraud and ensure the safety of all transactions. By integrating with existing POS systems, Lettuce aims to provide a smooth transition for businesses looking to adopt cryptocurrency payments. The development team is committed to continuous improvement and regularly updates the application to incorporate user feedback and new technological advancements.",,,,,,,,,,,,,,,,,
Free Voting Platform ,SCF #5,Free Voting Platform ,Free Voting Platform ,Applications,https://communityfund.stellar.org/dashboard/submissions/recd1qeJidXyA4Lpm,Awarded,,SCF Legacy Award,$38388.31,$48714.05,450592.89,8/18/2020,Legacy v1.0 Award,,"Xlet: Open Stellar Hardware Wallet

Xlet is an open-source hardware wallet for the Stellar network. It is designed to provide a secure and user-friendly way to store and manage Stellar assets. The wallet is built on the principles of security, transparency, and decentralization. It aims to offer a high level of security by isolating private keys from potentially compromised computers and mobile devices. The wallet is designed to be easy to use, with a simple interface that allows users to manage their assets without needing to understand the underlying technology.

The Xlet hardware wallet is based on the popular Ledger Nano S and Nano X devices. It uses the same secure element and firmware as these devices, but with custom software that is tailored to the Stellar network. This ensures that the wallet is both secure and compatible with existing Stellar tools and services. The wallet supports all of the features of the Stellar network, including multi-signature accounts, asset issuance, and decentralized exchanges. It also includes support for Stellar's inflation mechanism, allowing users to participate in the network's inflation rewards.

The Xlet project is open-source, with all of the hardware and software components available on GitHub. This allows anyone to review the code and contribute to the project. The project is also community-driven, with a focus on collaboration and transparency. The goal is to create a wallet that is secure, easy to use, and accessible to everyone. The Xlet team is committed to providing regular updates and improvements to the wallet, with a focus on security and usability. The project is funded through a combination of community donations and grants from the Stellar Development Foundation.",,,,,,,,,,,,,,,,,
The Interstellar Platform,SCF #5,The Interstellar Platform,The Interstellar Platform,Applications,https://communityfund.stellar.org/dashboard/submissions/recxPA89AEpKyJpcP,Awarded,,SCF Legacy Award,$44868.20,$44868.20,415019.76,8/18/2020,Legacy v1.0 Award,"A powerful, feature rich and multi-platform non-custodial wallet and exchange app built on Stellar and serving Stellar users since 2017.","StellarMint - Stellar Tokens Made Easier

StellarMint is a service that allows you to create and manage Stellar tokens easily. Whether you are a developer, entrepreneur, or just someone interested in blockchain technology, StellarMint simplifies the process of issuing and managing tokens on the Stellar network. 

With StellarMint, you can create a new token in just a few clicks. The service provides a user-friendly interface that guides you through the process of setting up your token, including defining its name, symbol, and initial supply. Once your token is created, you can manage it through the StellarMint dashboard. This includes the ability to issue additional tokens, burn tokens, and transfer tokens to other Stellar accounts.

StellarMint also offers advanced features for more experienced users. You can set up custom token properties, such as setting a fixed supply or enabling token freezing. Additionally, StellarMint provides tools for integrating your token with other Stellar-based services, such as decentralized exchanges and payment processors.

One of the key benefits of using StellarMint is its simplicity. The service abstracts away much of the complexity involved in working with the Stellar network, allowing you to focus on your project rather than the technical details. StellarMint also provides comprehensive documentation and support to help you get started and make the most of the platform.

In summary, StellarMint is a powerful tool for anyone looking to create and manage Stellar tokens. Its user-friendly interface, advanced features, and comprehensive support make it an ideal choice for both beginners and experienced users.",,,https://galactictalk.org/d/2412-the-interstellar-platform,,,,,,,,,"Ernest, Ernest ",,,,,
OpenSolar,SCF #5,OpenSolar: Securitized project financing powered by Stellar,OpenSolar,Applications,https://communityfund.stellar.org/dashboard/submissions/recei4RC1NYovsqZi,Awarded,,SCF Legacy Award,$24357.02,$24357.02,225296.44,8/18/2020,Legacy v1.0 Award,,"Rigel - Monetize Links for Payments and Donations in Seconds

Rigel is a platform that allows you to monetize your links for payments and donations in seconds. It is designed to be simple and easy to use, enabling anyone to start accepting payments and donations quickly. With Rigel, you can create a link, share it, and start receiving payments or donations instantly. The platform supports various payment methods, making it convenient for users to contribute. Rigel aims to provide a seamless experience for both the link creator and the contributors, ensuring that the process is straightforward and efficient. Whether you are a content creator, a fundraiser, or someone looking to receive payments, Rigel offers a solution that meets your needs.",,,,,,,,,,,,,,,,,
Cosmic.vote,SCF #5,Cosmic.vote ~ Working Toward Decentralized Organizations ,Cosmic.vote,Infrastructure & Services,https://communityfund.stellar.org/dashboard/submissions/recFHsO8eBVbiOIAg,Awarded,,SCF Legacy Award,$17947.28,$17947.28,166007.91,8/18/2020,Legacy v1.0 Award,,"The Interstellar Platform is a decentralized platform designed to facilitate the creation and management of digital assets. It leverages blockchain technology to ensure security, transparency, and immutability. The platform supports a wide range of applications, including token issuance, smart contracts, and decentralized finance (DeFi) solutions. By providing a robust and scalable infrastructure, the Interstellar Platform aims to empower developers and businesses to innovate and build next-generation applications. Key features of the platform include high throughput, low latency, and interoperability with other blockchain networks. The platform's native token, IST, is used for transaction fees, staking, and governance. The Interstellar Platform is committed to fostering a vibrant ecosystem by offering comprehensive developer tools, resources, and support.",,,,,,,,,,,,,,,,,
Stellarmint,SCF #5,Stellarmint,Stellarmint,Developer Tooling,https://communityfund.stellar.org/dashboard/submissions/recqwxZuu8Ox6MgqP,Awarded,,SCF Legacy Award,$51277.94,$51277.94,474308.3,8/18/2020,Legacy v1.0 Award,Stellarmint makes creating tokens on the Stellar network even easier.,,,,https://galactictalk.org/d/2383-stellarmint-stellar-tokens-made-easier,,,,,,,,,Daniel Fisher ,,,,,
Stellar Update,SCF #5,Stellar Update - Dedicated Blog about everything Stellar,Stellar Update,Education & Community,https://communityfund.stellar.org/dashboard/submissions/recZNvq8ujTrxpxgJ,Awarded,,SCF Legacy Award,$56319.82,$56319.82,545454.55,8/24/2020,Legacy v1.0 Award,,"I don't have the ability to browse the internet. Please provide the content you want to be streamlined, and I'll be happy to help.",,,,,,,,,,,,,,,,,
