Submission / Project,Round,Submission Title,Project,Category (from Project),Submission URL,Status,Tranche Completion %,Latest Tranche (from Payments),Total Awarded (USD),Total Paid (USD),Total Paid (XLM),Most Recent Payment Date,Award Type,One-Sentence-Description,Products & Services,Technical Architecture,Success Criteria,Website,Code,Video,Use Soroban?,Go-To-Market Plan,Traction Evidence,Tranche 1 - Deliverables,Tranche 2 - Testnet,Tranche 3 - Mainnet,Team Members,Thumbnail,LinkedIn (from Project),X (from Project),Discord (from Project),Pitch Deck (from Project)
Mojoflower,SCF #7,Mojoflower - Government issue share-ledgers and share-management tools for SMEs.,Mojoflower,Applications,https://communityfund.stellar.org/dashboard/submissions/recY7hkMQ59n12mOa,Awarded,,SCF Legacy Award,$196415.00,$196415.00,462754.0,5/24/2021,Legacy v2.0 Award,Government issue share-ledgers and share-management tools for SMEs powered by Stellar.,,,,https://mojoflower.io/,,,,,,,,,Ólafur Páll Torfason,,https://www.linkedin.com/company/mojoflower/,https://twitter.com/home/Mojoflower,,
Litemint,SCF #7,Litemint – Gaming Platform and NFT Marketplace,Litemint,Applications,https://communityfund.stellar.org/dashboard/submissions/recNYpfzGg7h2uLau,Awarded,,SCF Legacy Award,$273723.63,$273723.63,632054.0,5/25/2021,Legacy v2.0 Award,LITEMINT is a gaming platform connecting gamers to the crypto world.,,,,https://litemint.com,,https://youtu.be/VBzUwaWfxy8,,,,,,,Frederic James Bernard Rezeau,,https://www.linkedin.com/company/litemint,https://twitter.com/LitemintHQ,https://litemint.gg,
Task.io,SCF #7,Task.io - Economies that reward and connect people,Task.io,Applications,https://communityfund.stellar.org/dashboard/submissions/rechmD8fdwrII1xaQ,Awarded,,SCF Legacy Award,$283499.00,$283499.00,654628.0,5/25/2021,Legacy v2.0 Award,"Task connects organisations with remote teams, tracks activity on the Stellar blockchain, processes payments between users and allows the exchange of tokens for locally relevant rewards.",,,,https://task.io,,https://www.youtube.com/watch?v=efB1bPhgucM,,,,,,,"Matt Rickard, Steve Walker",,,https://twitter.com/taskdotio,,
Whalestack,SCF #7,COINQVEST - Enterprise Payment Processing,Whalestack,Applications,https://communityfund.stellar.org/dashboard/submissions/recclYO5p5WMKnecg,Awarded,,SCF Legacy Award,$354506.00,$354506.00,835214.0,5/25/2021,Legacy v2.0 Award,COINQVEST helps online merchants and e-commerce shops programmatically accept and settle payments in digital currencies while staying compliant.,,,,https://www.coinqvest.com,,https://www.youtube.com/watch?v=cybH9FlX-Q4,,,,,,,Marcin Olszowy,,,,,
Blocknify,SCF #7,Blocknify,Blocknify,Applications,https://communityfund.stellar.org/dashboard/submissions/reca8IhnJRD2KYwxp,Awarded,,SCF Legacy Award,$131973.75,$131973.75,304740.0,5/25/2021,Legacy v2.0 Award,,,,,,,,,,,,,,,,,,,
Leaf Global Fintech,SCF #7,Leaf Global Fintech: Banking Beyond the Branch,Leaf Global Fintech,Applications,https://communityfund.stellar.org/dashboard/submissions/recGnQ6l4nKzgQLpT,Awarded,,SCF Legacy Award,$249112.00,$249112.00,586907.0,5/24/2021,Legacy v2.0 Award,"Leaf is a digital wallet that enables users to store, send and receive, and exchange in multiple stablecoins on their phones— no smartphone required.",,,,https://leafglobalfintech.com/wallet-2-0/,,https://youtu.be/97gGtLOMaVA,,,,,,,"Tori Samples, Nathaniel Robinson",,,,,
Anclap,SCF #7,Anclap; Anchor + Debit Card for everyday transactions!,Anclap,Financial Protocols,https://communityfund.stellar.org/dashboard/submissions/reclgGPwy2rlCwsp9,Awarded,,SCF Legacy Award,$325762.00,$325762.00,767494.0,5/24/2021,Legacy v2.0 Award,Anclap connects the Stellar Network to real world services.,,,,https://www.anclap.com/,,https://youtu.be/BN3aJs9f6PM,,,,,,,"IVAN AGUSTIN MUDRYJ, Mariano Omar Morales",,,https://twitter.com/AnclapFintech,,
OptionBlox & YieldBlox,SCF #7,OptionBlox & YieldBlox - DeFi Protocols for Financial Derivatives and Lending,OptionBlox & YieldBlox,Financial Protocols,https://communityfund.stellar.org/dashboard/submissions/rec5uH1bD72BKoRPI,Awarded,,SCF Legacy Award,$320972.00,$320972.00,756208.0,5/24/2021,Legacy v2.0 Award,"Script3 created OptionBlox and YieldBlox. Platforms and DeFi protocols for facilitating financial derivatives and lending, respectively.",,,,https://www.script3.io/,,https://vimeo.com/501316746?ref=em-share,,,,,,,"Andrew Pierskalla, Markus Paulson-Luna, Alex Mootz",,,,,
